[
  {
    "id": "template-first-touch-avd",
    "title": "AVD first-touch",
    "tone": "Consultative",
    "category": "first-touch",
    "segments": {
      "opener": "I saw your note about Azure Virtual Desktop operations and wanted to reach out with something specific rather than a generic VDI pitch.",
      "valueProp": "Teams evaluating AVD usually need tighter control over cost, host-pool behavior, and operational visibility before scaling desktop estates.",
      "nextStep": "If that is where your team is, I can send a short summary of the cost-control and governance angles that tend to matter first."
    },
    "editable": true,
    "keywords": ["avd", "cost", "vdi", "first touch"]
  },
  {
    "id": "template-first-touch-w365",
    "title": "Windows 365 contractor opener",
    "tone": "Direct",
    "category": "first-touch",
    "segments": {
      "opener": "Your BYOD and contractor note stood out because that usually means teams need secure desktop access fast without managing more shipped hardware.",
      "valueProp": "Windows 365 conversations tend to go well when the workflow is framed around onboarding speed, device trust, and access consistency.",
      "nextStep": "I can send a quick outline of how teams use Cloud PCs for contractor-heavy environments if that would be useful."
    },
    "editable": true,
    "keywords": ["windows 365", "cloud pc", "contractor", "byod"]
  },
  {
    "id": "template-follow-up-intune",
    "title": "Intune follow-up",
    "tone": "Professional",
    "category": "follow-up",
    "segments": {
      "opener": "Following up on the compliance thread because your audit timing makes the reporting gap feel urgent.",
      "valueProp": "The strongest conversations here usually connect policy visibility, app deployment confidence, and exception handling instead of treating them as separate projects.",
      "nextStep": "If helpful, I can send a concise breakdown of the operations story we would use for that discussion."
    },
    "editable": true,
    "keywords": ["intune", "compliance", "follow-up", "audit"]
  },
  {
    "id": "template-objection-budget",
    "title": "Budget-timing objection",
    "tone": "Measured",
    "category": "objection-handling",
    "segments": {
      "opener": "Budget timing is a fair constraint, so I do not want to force an active motion if the window is not open yet.",
      "valueProp": "What usually helps is capturing the operational pain and a dated re-entry point so the opportunity does not lose context when timing improves.",
      "nextStep": "I can keep the follow-up light and reconnect when your budget cycle changes."
    },
    "editable": true,
    "keywords": ["budget", "timing", "objection", "nurture"]
  },
  {
    "id": "template-meeting-confirmation",
    "title": "Meeting confirmation",
    "tone": "Clear",
    "category": "meeting-confirmation",
    "segments": {
      "opener": "Thanks for booking time.",
      "valueProp": "To keep the discussion practical, I’d like to anchor it on your current desktop workflow, the Microsoft workload in scope, and the decision criteria your team cares about most.",
      "nextStep": "I’ll send a short agenda and the questions we should answer together before the session."
    },
    "editable": true,
    "keywords": ["meeting", "agenda", "confirmation"]
  },
  {
    "id": "template-handoff-intro",
    "title": "AE handoff intro",
    "tone": "Confident",
    "category": "handoff-intro",
    "segments": {
      "opener": "I’ve captured the qualification notes and want to make the handoff clean for your next conversation.",
      "valueProp": "The strongest handoffs keep the buyer role, Microsoft workload, pain points, and dated next step in one brief so the opportunity does not reset.",
      "nextStep": "I’ll package the summary and loop in the right account executive with the agreed follow-up date."
    },
    "editable": true,
    "keywords": ["handoff", "ae", "summary"]
  },
  {
    "id": "template-nurture-check-in",
    "title": "Nurture re-entry note",
    "tone": "Light",
    "category": "nurture",
    "segments": {
      "opener": "Reaching back out at the timing you suggested.",
      "valueProp": "I’ve kept the context around your desktop workflow and the Microsoft use case so you do not need to restate the problem from scratch.",
      "nextStep": "If priorities have shifted, I can send a short restart summary and we can decide whether it belongs back in active work."
    },
    "editable": true,
    "keywords": ["nurture", "re-entry", "follow-up"]
  }
]
